{
  "chain": "terra_classic",
  "name": "Terra Classic",
  "timestamp": "2026-02-25T00:00:00Z",
  "tokens": [
    {
      "id": "terra_classic/native/uluna",
      "chain": "terra_classic",
      "type": "native",
      "symbol": "LUNC",
      "name": "Terra Luna Classic",
      "denom": "uluna",
      "decimals": 6,
      "logoURI": "assets/tokens/lunc.svg",
      "coinmarketcapId": "4172",
      "coingeckoId": "terra-luna",
      "priceSources": [
        {
          "provider": "coinmarketcap",
          "id": "4172",
          "priority": 1,
          "enabled": true
        },
        {
          "provider": "coingecko",
          "id": "terra-luna",
          "priority": 2,
          "enabled": true
        },
        {
          "provider": "vyntrex",
          "contract": "terra1...",
          "api": "https://api.vyntrex.io",
          "priority": 3,
          "enabled": true
        }
      ],
      "website": "https://terra-classic.io",
      "x": "https://x.com/terra_money",
      "description": "Native staking and fee token of Terra Classic.",
      "verified": true,
      "tags": ["native", "staking", "governance"]
    },
    {
      "id": "terra_classic/native/uusd",
      "chain": "terra_classic",
      "type": "native",
      "symbol": "USTC",
      "name": "TerraClassicUSD",
      "denom": "uusd",
      "decimals": 6,
      "logoURI": "assets/tokens/ustc.svg",
      "coinmarketcapId": "7129",
      "coingeckoId": "terrausd",
      "priceSources": [
        {
          "provider": "coinmarketcap",
          "id": "7129",
          "priority": 1,
          "enabled": true
        },
        {
          "provider": "coingecko",
          "id": "terrausd",
          "priority": 2,
          "enabled": true
        },
        {
          "provider": "vyntrex",
          "contract": "terra1...",
          "api": "https://api.vyntrex.io",
          "priority": 3,
          "enabled": true
        }
      ],
      "website": "https://terra-classic.io",
      "description": "Native stablecoin asset on Terra Classic.",
      "verified": true,
      "tags": ["native", "stablecoin"]
    }
  ]
}
